{
  "id": "atlas-f-sudlib-martinique-fr-rt",
  "domain": "transit.vehicles",
  "name": "SudLib",
  "provider": "SudLib",
  "coverage": {
    "bbox": [
      14.4431,
      -61.0943,
      14.6549,
      -60.8238
    ],
    "countries": []
  },
  "access": {
    "url": "https://api.pysae.com/api/v4/groups/sud_lib/gtfs-rt",
    "redirectHosts": [],
    "unzip": null,
    "headers": {},
    "min_interval_s": 15
  },
  "format": "gtfs-rt.vehicle-positions",
  "licence": {
    "id": "etalab-2.0",
    "url": "https://spdx.org/licenses/etalab-2.0",
    "display": true,
    "commercial": true,
    "attribution": "SudLib"
  },
  "licence_decision": {
    "by": "known-licence",
    "evidence": [
      {
        "field": "licence",
        "quote": "https://spdx.org/licenses/etalab-2.0"
      }
    ],
    "terms_sha256": null,
    "at": "2026-10-14T16:46:39.572Z"
  },
  "provenance": [
    "transitland-atlas:f-sudlib~martinique~fr~rt"
  ]
}
