{
  "id": "mdb-tdg-83855",
  "domain": "transit.vehicles",
  "name": "Réseau urbain Olé",
  "provider": "Communauté d'Agglomération Lunel Agglo",
  "coverage": {
    "bbox": [
      43.64247,
      4.014007460837726,
      43.79514065811532,
      4.17625776858275
    ],
    "countries": [
      "FR"
    ]
  },
  "access": {
    "url": "https://www.data.gouv.fr/api/1/datasets/r/5511d6c1-1454-4045-a2f5-1223f22d7530",
    "redirectHosts": [],
    "unzip": null,
    "headers": {},
    "min_interval_s": 15
  },
  "format": "gtfs-rt.vehicle-positions",
  "licence": {
    "id": "etalab-2.0",
    "url": "https://www.data.gouv.fr/pages/legal/licences/etalab-2.0",
    "display": true,
    "commercial": true,
    "attribution": "Communauté d'Agglomération Lunel Agglo"
  },
  "licence_decision": {
    "by": "known-licence",
    "evidence": [
      {
        "field": "licence",
        "quote": "https://www.data.gouv.fr/pages/legal/licences/etalab-2.0"
      }
    ],
    "terms_sha256": null,
    "at": "2026-10-14T15:21:58.642Z"
  },
  "provenance": [
    "mobilitydatabase:tdg-83855"
  ]
}
