{
  "id": "mdb-1841",
  "domain": "transit.vehicles",
  "name": "Réseau urbain Cap Cotentin",
  "provider": "Réseau urbain Cap Cotentin",
  "coverage": {
    "bbox": [
      48.104003,
      -1.944424,
      49.715702,
      -1.259287
    ],
    "countries": [
      "FR"
    ]
  },
  "access": {
    "url": "https://pysae.com/api/v2/groups/transdev-cotentin/gtfs-rt",
    "redirectHosts": [],
    "unzip": null,
    "headers": {},
    "min_interval_s": 15
  },
  "format": "gtfs-rt.vehicle-positions",
  "licence": {
    "id": "etalab-2.0",
    "url": "https://www.etalab.gouv.fr/wp-content/uploads/2017/04/ETALAB-Licence-Ouverte-v2.0.pdf",
    "display": true,
    "commercial": true,
    "attribution": "Réseau urbain Cap Cotentin"
  },
  "licence_decision": {
    "by": "known-licence",
    "evidence": [
      {
        "field": "licence",
        "quote": "https://www.etalab.gouv.fr/wp-content/uploads/2017/04/ETALAB-Licence-Ouverte-v2.0.pdf"
      }
    ],
    "terms_sha256": null,
    "at": "2026-10-14T15:21:58.369Z"
  },
  "provenance": [
    "mobilitydatabase:mdb-1841"
  ]
}
