{
  "id": "mdb-jbda-kaetsunou-kaetsunouippan-vp",
  "domain": "transit.vehicles",
  "name": "加越能バス（一般路線）",
  "provider": "加越能バス",
  "coverage": {
    "bbox": [
      36.52218,
      136.646149728571,
      36.95785449,
      137.159049979091
    ],
    "countries": [
      "JP"
    ]
  },
  "access": {
    "url": "https://gtfs-rt-files.buscatch.jp/toyama/kaetsuno/VehiclePositions.pb",
    "redirectHosts": [],
    "unzip": null,
    "headers": {},
    "min_interval_s": 15
  },
  "format": "gtfs-rt.vehicle-positions",
  "licence": {
    "id": "CC0-1.0",
    "url": "https://creativecommons.org/publicdomain/zero/1.0/deed.ja",
    "display": true,
    "commercial": true,
    "attribution": "加越能バス"
  },
  "licence_decision": {
    "by": "known-licence",
    "evidence": [
      {
        "field": "licence",
        "quote": "https://creativecommons.org/publicdomain/zero/1.0/deed.ja"
      }
    ],
    "terms_sha256": null,
    "at": "2026-10-14T15:21:58.508Z"
  },
  "provenance": [
    "mobilitydatabase:jbda-kaetsunou-kaetsunouippan-vp"
  ]
}
