{
  "id": "mdb-tdg-12609",
  "domain": "transit.vehicles",
  "name": "Réseau urbain May'bus",
  "provider": "Zenbus",
  "coverage": {
    "bbox": [
      48.286586,
      -0.642207,
      48.318,
      -0.594489
    ],
    "countries": [
      "FR"
    ]
  },
  "access": {
    "url": "https://zenbus.net/gtfs/rt/poll.proto?dataset=maybus",
    "redirectHosts": [],
    "unzip": null,
    "headers": {},
    "min_interval_s": 15
  },
  "format": "gtfs-rt.vehicle-positions",
  "licence": {
    "id": "ODbL-1.0",
    "url": "https://opendatacommons.org/licenses/odbl/1.0/",
    "display": true,
    "commercial": true,
    "attribution": "Zenbus"
  },
  "licence_decision": {
    "by": "known-licence",
    "evidence": [
      {
        "field": "licence",
        "quote": "https://opendatacommons.org/licenses/odbl/1.0/"
      }
    ],
    "terms_sha256": null,
    "at": "2026-10-14T15:21:58.574Z"
  },
  "provenance": [
    "mobilitydatabase:tdg-12609",
    "via:https://www.data.gouv.fr/api/1/datasets/r/6a1ef3cc-13cc-4770-a347-f183dc6accd6"
  ]
}
