{
  "id": "mdb-1561",
  "domain": "transit.vehicles",
  "name": "London Transit Commission",
  "provider": "London Transit Commission",
  "coverage": {
    "bbox": [
      42.905244,
      -81.36311,
      43.051188,
      -81.132066
    ],
    "countries": [
      "CA"
    ]
  },
  "access": {
    "url": "http://gtfs.ltconline.ca/Vehicle/VehiclePositions.pb",
    "redirectHosts": [],
    "unzip": null,
    "headers": {},
    "min_interval_s": 15
  },
  "format": "gtfs-rt.vehicle-positions",
  "licence": {
    "id": null,
    "url": "https://www.londontransit.ca/open-data/ltcs-open-data-terms-of-use/",
    "display": false,
    "commercial": null,
    "attribution": "London Transit Commission"
  },
  "licence_decision": {
    "by": "none",
    "evidence": [
      {
        "field": "reason",
        "quote": "confidence below 0.9"
      }
    ],
    "terms_sha256": null,
    "at": "2026-10-15T19:05:30.458Z"
  },
  "provenance": [
    "mobilitydatabase:mdb-1561",
    "licence-atlas:f-dpwh-londontransit~rt"
  ]
}
