{
  "id": "mdb-tld-5553-vp",
  "domain": "transit.vehicles",
  "name": "San Luis Obispo Regional Transit Authority",
  "provider": "San Luis Obispo Regional Transit Authority",
  "coverage": {
    "bbox": [
      34.944001,
      -121.186588,
      35.752511,
      -120.413275
    ],
    "countries": [
      "US"
    ]
  },
  "access": {
    "url": "https://slo.connexionz.net/rtt/public/utility/gtfsrealtime.aspx/vehicleposition",
    "redirectHosts": [],
    "unzip": null,
    "headers": {},
    "min_interval_s": 15
  },
  "format": "gtfs-rt.vehicle-positions",
  "licence": {
    "id": null,
    "url": null,
    "display": false,
    "commercial": null,
    "attribution": "San Luis Obispo Regional Transit Authority"
  },
  "licence_decision": {
    "by": "none",
    "evidence": [
      {
        "field": "reason",
        "quote": "no licence published"
      }
    ],
    "terms_sha256": null,
    "at": "2026-10-14T15:21:58.733Z"
  },
  "provenance": [
    "mobilitydatabase:tld-5553-vp",
    "via:http://slo.connexionz.net/rtt/public/utility/gtfsrealtime.aspx/vehicleposition"
  ]
}
