{
  "id": "mdb-tld-5870-vp",
  "domain": "transit.vehicles",
  "name": "MRC de Montcalm",
  "provider": "MRC de Montcalm",
  "coverage": {
    "bbox": [
      45.721729,
      -74.017769,
      45.888416,
      -73.705711
    ],
    "countries": [
      "CA"
    ]
  },
  "access": {
    "url": "https://zenbus.net/gtfs/rt/poll.proto?file=vp&dataset=mrc-montcalm",
    "redirectHosts": [],
    "unzip": null,
    "headers": {},
    "min_interval_s": 15
  },
  "format": "gtfs-rt.vehicle-positions",
  "licence": {
    "id": null,
    "url": null,
    "display": false,
    "commercial": null,
    "attribution": "MRC de Montcalm"
  },
  "licence_decision": {
    "by": "none",
    "evidence": [
      {
        "field": "reason",
        "quote": "no licence published"
      }
    ],
    "terms_sha256": null,
    "at": "2026-10-14T15:21:58.747Z"
  },
  "provenance": [
    "mobilitydatabase:tld-5870-vp"
  ]
}
